{
  "$schema": "https://json-schema.org/draft/2020-12/schema",
  "type": "array",
  "items": {
    "type": "object",
    "required": ["iso_num", "iso3", "stance", "measures", "notes"],
    "properties": {
      "iso_num": {"type": "integer"},
      "iso3": {"type": "string", "minLength": 2, "maxLength": 3},
      "stance": {"type": ["string", "null"], "enum": ["raise", "maintain", "lower", "none", null]},
      "measures": {
        "type": "object",
        "additionalProperties": {"type": ["boolean", "null"]}
      },
      "notes": {"type": ["string", "null"]}
    }
  }
}
