[
  {
    "iso_num": 533,
    "iso3": "ABW",
    "stance": null,
    "measures": {
      "baby_bonus": null,
      "parental_leave": null,
      "childcare_subsidy": null,
      "tax_incentive": null
    },
    "notes": null
  },
  {
    "iso_num": 4,
    "iso3": "AFG",
    "stance": "lower",
    "measures": {
      "baby_bonus": null,
      "parental_leave": null,
      "childcare_subsidy": null,
      "tax_incentive": null
    },
    "notes": null
  },
  {
    "iso_num": 24,
    "iso3": "AGO",
    "stance": "lower",
    "measures": {
      "baby_bonus": null,
      "parental_leave": null,
      "childcare_subsidy": null,
      "tax_incentive": null
    },
    "notes": null
  },
  {
    "iso_num": 8,
    "iso3": "ALB",
    "stance": "raise",
    "measures": {
      "baby_bonus": null,
      "parental_leave": null,
      "childcare_subsidy": null,
      "tax_incentive": null
    },
    "notes": null
  },
  {
    "iso_num": 20,
    "iso3": "AND",
    "stance": null,
    "measures": {
      "baby_bonus": null,
      "parental_leave": null,
      "childcare_subsidy": null,
      "tax_incentive": null
    },
    "notes": null
  },
  {
    "iso_num": 784,
    "iso3": "ARE",
    "stance": "raise",
    "measures": {
      "baby_bonus": null,
      "parental_leave": null,
      "childcare_subsidy": null,
      "tax_incentive": null
    },
    "notes": null
  },
  {
    "iso_num": 32,
    "iso3": "ARG",
    "stance": "maintain",
    "measures": {
      "baby_bonus": null,
      "parental_leave": null,
      "childcare_subsidy": null,
      "tax_incentive": null
    },
    "notes": null
  },
  {
    "iso_num": 51,
    "iso3": "ARM",
    "stance": "raise",
    "measures": {
      "baby_bonus": null,
      "parental_leave": null,
      "childcare_subsidy": null,
      "tax_incentive": null
    },
    "notes": null
  },
  {
    "iso_num": 16,
    "iso3": "ASM",
    "stance": null,
    "measures": {
      "baby_bonus": null,
      "parental_leave": null,
      "childcare_subsidy": null,
      "tax_incentive": null
    },
    "notes": null
  },
  {
    "iso_num": 28,
    "iso3": "ATG",
    "stance": "none",
    "measures": {
      "baby_bonus": null,
      "parental_leave": null,
      "childcare_subsidy": null,
      "tax_incentive": null
    },
    "notes": null
  },
  {
    "iso_num": 36,
    "iso3": "AUS",
    "stance": "none",
    "measures": {
      "baby_bonus": null,
      "parental_leave": null,
      "childcare_subsidy": null,
      "tax_incentive": null
    },
    "notes": null
  },
  {
    "iso_num": 40,
    "iso3": "AUT",
    "stance": "raise",
    "measures": {
      "baby_bonus": null,
      "parental_leave": null,
      "childcare_subsidy": null,
      "tax_incentive": null
    },
    "notes": null
  },
  {
    "iso_num": 31,
    "iso3": "AZE",
    "stance": "maintain",
    "measures": {
      "baby_bonus": null,
      "parental_leave": null,
      "childcare_subsidy": null,
      "tax_incentive": null
    },
    "notes": null
  },
  {
    "iso_num": 108,
    "iso3": "BDI",
    "stance": "lower",
    "measures": {
      "baby_bonus": null,
      "parental_leave": null,
      "childcare_subsidy": null,
      "tax_incentive": null
    },
    "notes": null
  },
  {
    "iso_num": 56,
    "iso3": "BEL",
    "stance": "maintain",
    "measures": {
      "baby_bonus": null,
      "parental_leave": null,
      "childcare_subsidy": null,
      "tax_incentive": null
    },
    "notes": null
  },
  {
    "iso_num": 204,
    "iso3": "BEN",
    "stance": "lower",
    "measures": {
      "baby_bonus": null,
      "parental_leave": null,
      "childcare_subsidy": null,
      "tax_incentive": null
    },
    "notes": null
  },
  {
    "iso_num": 854,
    "iso3": "BFA",
    "stance": "lower",
    "measures": {
      "baby_bonus": null,
      "parental_leave": null,
      "childcare_subsidy": null,
      "tax_incentive": null
    },
    "notes": null
  },
  {
    "iso_num": 50,
    "iso3": "BGD",
    "stance": "lower",
    "measures": {
      "baby_bonus": null,
      "parental_leave": null,
      "childcare_subsidy": null,
      "tax_incentive": null
    },
    "notes": null
  },
  {
    "iso_num": 100,
    "iso3": "BGR",
    "stance": "raise",
    "measures": {
      "baby_bonus": null,
      "parental_leave": null,
      "childcare_subsidy": null,
      "tax_incentive": null
    },
    "notes": null
  },
  {
    "iso_num": 48,
    "iso3": "BHR",
    "stance": "lower",
    "measures": {
      "baby_bonus": null,
      "parental_leave": null,
      "childcare_subsidy": null,
      "tax_incentive": null
    },
    "notes": null
  },
  {
    "iso_num": 44,
    "iso3": "BHS",
    "stance": "none",
    "measures": {
      "baby_bonus": null,
      "parental_leave": null,
      "childcare_subsidy": null,
      "tax_incentive": null
    },
    "notes": null
  },
  {
    "iso_num": 70,
    "iso3": "BIH",
    "stance": "none",
    "measures": {
      "baby_bonus": null,
      "parental_leave": null,
      "childcare_subsidy": null,
      "tax_incentive": null
    },
    "notes": null
  },
  {
    "iso_num": 112,
    "iso3": "BLR",
    "stance": "raise",
    "measures": {
      "baby_bonus": null,
      "parental_leave": null,
      "childcare_subsidy": null,
      "tax_incentive": null
    },
    "notes": null
  },
  {
    "iso_num": 84,
    "iso3": "BLZ",
    "stance": "none",
    "measures": {
      "baby_bonus": null,
      "parental_leave": null,
      "childcare_subsidy": null,
      "tax_incentive": null
    },
    "notes": null
  },
  {
    "iso_num": 60,
    "iso3": "BMU",
    "stance": null,
    "measures": {
      "baby_bonus": null,
      "parental_leave": null,
      "childcare_subsidy": null,
      "tax_incentive": null
    },
    "notes": null
  },
  {
    "iso_num": 68,
    "iso3": "BOL",
    "stance": "maintain",
    "measures": {
      "baby_bonus": null,
      "parental_leave": null,
      "childcare_subsidy": null,
      "tax_incentive": null
    },
    "notes": null
  },
  {
    "iso_num": 76,
    "iso3": "BRA",
    "stance": "none",
    "measures": {
      "baby_bonus": null,
      "parental_leave": null,
      "childcare_subsidy": null,
      "tax_incentive": null
    },
    "notes": null
  },
  {
    "iso_num": 52,
    "iso3": "BRB",
    "stance": "none",
    "measures": {
      "baby_bonus": null,
      "parental_leave": null,
      "childcare_subsidy": null,
      "tax_incentive": null
    },
    "notes": null
  },
  {
    "iso_num": 96,
    "iso3": "BRN",
    "stance": "none",
    "measures": {
      "baby_bonus": null,
      "parental_leave": null,
      "childcare_subsidy": null,
      "tax_incentive": null
    },
    "notes": null
  },
  {
    "iso_num": 64,
    "iso3": "BTN",
    "stance": "lower",
    "measures": {
      "baby_bonus": null,
      "parental_leave": null,
      "childcare_subsidy": null,
      "tax_incentive": null
    },
    "notes": null
  },
  {
    "iso_num": 72,
    "iso3": "BWA",
    "stance": "maintain",
    "measures": {
      "baby_bonus": null,
      "parental_leave": null,
      "childcare_subsidy": null,
      "tax_incentive": null
    },
    "notes": null
  },
  {
    "iso_num": 140,
    "iso3": "CAF",
    "stance": "none",
    "measures": {
      "baby_bonus": null,
      "parental_leave": null,
      "childcare_subsidy": null,
      "tax_incentive": null
    },
    "notes": null
  },
  {
    "iso_num": 124,
    "iso3": "CAN",
    "stance": "none",
    "measures": {
      "baby_bonus": null,
      "parental_leave": null,
      "childcare_subsidy": null,
      "tax_incentive": null
    },
    "notes": null
  },
  {
    "iso_num": 756,
    "iso3": "CHE",
    "stance": "none",
    "measures": {
      "baby_bonus": null,
      "parental_leave": null,
      "childcare_subsidy": null,
      "tax_incentive": null
    },
    "notes": null
  },
  {
    "iso_num": 152,
    "iso3": "CHL",
    "stance": "raise",
    "measures": {
      "baby_bonus": null,
      "parental_leave": null,
      "childcare_subsidy": null,
      "tax_incentive": null
    },
    "notes": null
  },
  {
    "iso_num": 156,
    "iso3": "CHN",
    "stance": "raise",
    "measures": {
      "baby_bonus": null,
      "parental_leave": null,
      "childcare_subsidy": null,
      "tax_incentive": null
    },
    "notes": null
  },
  {
    "iso_num": 384,
    "iso3": "CIV",
    "stance": null,
    "measures": {
      "baby_bonus": null,
      "parental_leave": null,
      "childcare_subsidy": null,
      "tax_incentive": null
    },
    "notes": null
  },
  {
    "iso_num": 120,
    "iso3": "CMR",
    "stance": "lower",
    "measures": {
      "baby_bonus": null,
      "parental_leave": null,
      "childcare_subsidy": null,
      "tax_incentive": null
    },
    "notes": null
  },
  {
    "iso_num": 180,
    "iso3": "COD",
    "stance": null,
    "measures": {
      "baby_bonus": null,
      "parental_leave": null,
      "childcare_subsidy": null,
      "tax_incentive": null
    },
    "notes": null
  },
  {
    "iso_num": 178,
    "iso3": "COG",
    "stance": "none",
    "measures": {
      "baby_bonus": null,
      "parental_leave": null,
      "childcare_subsidy": null,
      "tax_incentive": null
    },
    "notes": null
  },
  {
    "iso_num": 170,
    "iso3": "COL",
    "stance": "maintain",
    "measures": {
      "baby_bonus": null,
      "parental_leave": null,
      "childcare_subsidy": null,
      "tax_incentive": null
    },
    "notes": null
  },
  {
    "iso_num": 174,
    "iso3": "COM",
    "stance": "lower",
    "measures": {
      "baby_bonus": null,
      "parental_leave": null,
      "childcare_subsidy": null,
      "tax_incentive": null
    },
    "notes": null
  },
  {
    "iso_num": 132,
    "iso3": "CPV",
    "stance": "lower",
    "measures": {
      "baby_bonus": null,
      "parental_leave": null,
      "childcare_subsidy": null,
      "tax_incentive": null
    },
    "notes": null
  },
  {
    "iso_num": 188,
    "iso3": "CRI",
    "stance": "none",
    "measures": {